{
  "schema_version": "1.0",
  "captured_at": "2026-08-30T00:00:00Z",
  "environment": {
    "environment_id": "fixture:weekly-only",
    "platform": "fixture",
    "architecture": "fixture",
    "boundary": "fixture"
  },
  "codex_executable": {
    "executable_id": "fixture-codex",
    "source": "fixture",
    "canonical_path": null,
    "file_identity": null,
    "version": "codex-cli 0.150.0-alpha.12.2"
  },
  "account": {
    "auth_mode": "chatgpt",
    "plan_type": "plus",
    "binding_status": "ephemeral"
  },
  "quota": {
    "windows": [
      {
        "limit_id": "codex_weekly:primary",
        "label": "weekly",
        "window_minutes": 10080,
        "used_percent": 62.0,
        "remaining_percent": 38.0,
        "resets_at": "2026-09-05T00:00:00Z"
      }
    ],
    "reset_credit_summary": {
      "summary_status": "unavailable",
      "available_count": null,
      "details_status": "unavailable",
      "credits": null
    },
    "usage_credit_summary": {
      "summary_status": "unavailable",
      "entries": [],
      "captured_at": "2026-08-30T00:00:00Z",
      "upstream_schema_fingerprint": null
    }
  },
  "usage": {
    "availability": "unsupported",
    "summary": null,
    "reason_codes": [
      "usage_capability_unavailable"
    ]
  },
  "data_status": {
    "availability": "partial",
    "freshness": "live",
    "compatibility": "expected_compatible",
    "reason_codes": [
      "live_app_server",
      "compatibility_expected",
      "single_bucket_fallback",
      "reset_credit_summary_unavailable"
    ]
  },
  "diagnostics": [
    {
      "code": "single_bucket_fallback",
      "severity": "warning",
      "message": "The app-server returned only the backward-compatible single-bucket quota view."
    }
  ]
}
