{
  "schema_version": "1.0",
  "captured_at": "2026-08-30T00:00:00Z",
  "environment": {
    "environment_id": "fixture:reset-credit-partial",
    "platform": "fixture",
    "architecture": "fixture",
    "boundary": "fixture"
  },
  "codex_executable": {
    "executable_id": "fixture-codex",
    "source": "fixture",
    "canonical_path": null,
    "file_identity": null,
    "version": "codex-cli 0.150.0-alpha.12.2"
  },
  "account": {
    "auth_mode": "chatgpt",
    "plan_type": "pro",
    "binding_status": "ephemeral"
  },
  "quota": {
    "windows": [
      {
        "limit_id": "codex:primary",
        "label": "5-hour",
        "window_minutes": 300,
        "used_percent": 15.0,
        "remaining_percent": 85.0,
        "resets_at": "2026-08-30T05:00:00Z"
      }
    ],
    "reset_credit_summary": {
      "summary_status": "available",
      "available_count": 2,
      "details_status": "partial",
      "credits": [
        {
          "opaque_id": "fixture-credit-partial-1",
          "reset_type": "codexRateLimits",
          "status": "available",
          "granted_at": "2026-08-29T00:00:00Z",
          "expires_at": "2026-09-30T00:00:00Z",
          "title": null,
          "description": null
        }
      ]
    },
    "usage_credit_summary": {
      "summary_status": "unavailable",
      "entries": [],
      "captured_at": "2026-08-30T00:00:00Z",
      "upstream_schema_fingerprint": null
    }
  },
  "usage": {
    "availability": "unsupported",
    "summary": null,
    "reason_codes": [
      "usage_capability_unavailable"
    ]
  },
  "data_status": {
    "availability": "partial",
    "freshness": "live",
    "compatibility": "expected_compatible",
    "reason_codes": [
      "live_app_server",
      "compatibility_expected",
      "reset_credit_details_partial"
    ]
  },
  "diagnostics": []
}
