{
  "schema_version": "1.0",
  "captured_at": "2026-08-30T00:00:00Z",
  "environment": {
    "environment_id": "fixture:no-fixed-window",
    "platform": "fixture",
    "architecture": "fixture",
    "boundary": "fixture"
  },
  "codex_executable": {
    "executable_id": "fixture-codex",
    "source": "fixture",
    "canonical_path": null,
    "file_identity": null,
    "version": "codex-cli 0.150.0-alpha.12.2"
  },
  "account": {
    "auth_mode": "chatgpt",
    "plan_type": "business",
    "binding_status": "ephemeral"
  },
  "quota": {
    "windows": [],
    "reset_credit_summary": {
      "summary_status": "unavailable",
      "available_count": null,
      "details_status": "unavailable",
      "credits": null
    },
    "usage_credit_summary": {
      "summary_status": "unavailable",
      "entries": [],
      "captured_at": "2026-08-30T00:00:00Z",
      "upstream_schema_fingerprint": null
    }
  },
  "usage": {
    "availability": "partial",
    "summary": null,
    "reason_codes": [
      "usage_summary_unavailable"
    ]
  },
  "data_status": {
    "availability": "unsupported",
    "freshness": "not_applicable",
    "compatibility": "not_applicable",
    "reason_codes": [
      "live_app_server",
      "reset_credit_summary_unavailable",
      "no_fixed_window"
    ]
  },
  "diagnostics": [
    {
      "code": "no_fixed_window",
      "severity": "warning",
      "message": "The account response did not include a fixed quota window."
    }
  ]
}
